{
  "$schema": "http://json-schema.org/draft-07/schema#",
  "title": "Portfolio Project Management System - Optimized JSON Schema",
  "description": "Efficient JSON-based schema that simulates relational database structure",
  
  "definitions": {
    "lookupItem": {
      "type": "object",
      "properties": {
        "id": { "type": "integer", "minimum": 1 },
        "type": { 
          "type": "string", 
          "enum": ["genre", "style", "technology", "mood", "role", "status", "variant", "link_type", "artifact_type", "content_type", "file_type"]
        },
        "value": { "type": "string", "minLength": 1, "maxLength": 255 },
        "description": { "type": "string" },
        "category": { 
          "type": "string", 
          "enum": ["code", "art", "writing", "universal"],
          "default": "universal"
        },
        "usage_count": { "type": "integer", "minimum": 0, "default": 0 },
        "metadata": {
          "type": "object",
          "properties": {
            "website": { "type": "string", "format": "uri" },
            "icon": { "type": "string" },
            "color": { "type": "string" },
            "sort_order": { "type": "integer", "default": 0 }
          },
          "additionalProperties": true
        },
        "created_at": { "type": "string", "format": "date-time" },
        "updated_at": { "type": "string", "format": "date-time" }
      },
      "required": ["id", "type", "value"],
      "additionalProperties": false
    },
    
    "project": {
      "type": "object",
      "properties": {
        "id": { "type": "integer", "minimum": 1 },
        "title": { "type": "string", "minLength": 1, "maxLength": 255 },
        "description": { "type": "string", "minLength": 10 },
        "image_url": { "type": "string", "format": "uri" },
        "medium": { 
          "type": "string", 
          "enum": ["code", "art", "writing"]
        },
        "mood": { "type": "string", "minLength": 1 },
        "year": { 
          "type": "integer", 
          "minimum": 2000, 
          "maximum": 2030 
        },
        "role": { "type": "string", "minLength": 1 },
        "variant": { 
          "type": "string", 
          "enum": ["featured", "wide", "standard"],
          "default": "standard"
        },
        "status": { 
          "type": "string", 
          "enum": ["completed", "in-progress", "development", "concept", "on-hold"],
          "default": "completed"
        },
        "pitch": { "type": "string", "minLength": 10 },
        "challenge": { "type": "string", "minLength": 10 },
        "development": { "type": "string", "minLength": 10 },
        "outcome": { "type": "string", "minLength": 10 },
        "genres": { 
          "type": "array", 
          "items": { "type": "integer" },
          "minItems": 1
        },
        "styles": { 
          "type": "array", 
          "items": { "type": "integer" },
          "minItems": 1
        },
        "technologies": { 
          "type": "array", 
          "items": { "type": "integer" }
        },
        "links": {
          "type": "array",
          "items": {
            "type": "object",
            "properties": {
              "id": { "type": "integer" },
              "text": { "type": "string", "minLength": 1 },
              "url": { "type": "string", "format": "uri" },
              "type": { "type": "integer" },
              "sort_order": { "type": "integer", "default": 0 }
            },
            "required": ["text", "url"]
          }
        },
        "gallery": {
          "type": "array",
          "items": {
            "type": "object",
            "properties": {
              "id": { "type": "integer" },
              "url": { "type": "string", "format": "uri" },
              "title": { "type": "string", "minLength": 1 },
              "description": { "type": "string" },
              "dimensions": { "type": "string" },
              "file_path": { "type": "string" },
              "file_size": { "type": "integer" },
              "sort_order": { "type": "integer", "default": 0 },
              "hotspots": {
                "type": "array",
                "items": {
                  "type": "object",
                  "properties": {
                    "id": { "type": "integer" },
                    "x": { "type": "number", "minimum": 0, "maximum": 100 },
                    "y": { "type": "number", "minimum": 0, "maximum": 100 },
                    "label": { "type": "string", "maxLength": 10 },
                    "title": { "type": "string", "minLength": 1 },
                    "description": { "type": "string", "minLength": 1 }
                  },
                  "required": ["x", "y", "label", "title", "description"]
                }
              }
            },
            "required": ["url", "title"]
          }
        },
        "artifacts": {
          "type": "array",
          "items": {
            "type": "object",
            "properties": {
              "id": { "type": "integer" },
              "name": { "type": "string", "minLength": 1 },
              "description": { "type": "string", "minLength": 1 },
              "url": { "type": "string", "format": "uri" },
              "type": { "type": "integer" },
              "file_path": { "type": "string" },
              "sort_order": { "type": "integer", "default": 0 }
            },
            "required": ["name", "description"]
          }
        },
        "content": {
          "type": "object",
          "properties": {
            "excerpts": { "type": "string" },
            "themes_analysis": { "type": "string" },
            "process_content": { "type": "string" },
            "inspiration_content": { "type": "string" }
          }
        },
        "journey": {
          "type": "array",
          "items": {
            "type": "object",
            "properties": {
              "id": { "type": "integer" },
              "title": { "type": "string", "minLength": 1 },
              "description": { "type": "string", "minLength": 1 },
              "sort_order": { "type": "integer", "default": 0 }
            },
            "required": ["title", "description"]
          }
        },
        "specs": {
          "type": "array",
          "items": {
            "type": "object",
            "properties": {
              "id": { "type": "integer" },
              "title": { "type": "string", "minLength": 1 },
              "description": { "type": "string", "minLength": 1 },
              "sort_order": { "type": "integer", "default": 0 }
            },
            "required": ["title", "description"]
          }
        },
        "files": {
          "type": "array",
          "items": {
            "type": "object",
            "properties": {
              "id": { "type": "integer" },
              "name": { "type": "string", "minLength": 1 },
              "path": { "type": "string", "minLength": 1 },
              "type": { "type": "integer" },
              "size": { "type": "integer" },
              "mime_type": { "type": "string" },
              "is_public": { "type": "boolean", "default": true }
            },
            "required": ["name", "path", "type"]
          }
        },
        "created_at": { "type": "string", "format": "date-time" },
        "updated_at": { "type": "string", "format": "date-time" },
        "published_at": { "type": "string", "format": "date-time" },
        "is_active": { "type": "boolean", "default": true }
      },
      "required": [
        "id", "title", "description", "image_url", "medium", "mood", 
        "year", "role", "pitch", "challenge", "development", "outcome",
        "genres", "styles"
      ],
      "additionalProperties": false
    },
    
    "systemConfig": {
      "type": "object",
      "properties": {
        "key": { "type": "string", "minLength": 1 },
        "value": { "type": "string" },
        "description": { "type": "string" },
        "updated_at": { "type": "string", "format": "date-time" }
      },
      "required": ["key", "value"],
      "additionalProperties": false
    },
    
    "auditLog": {
      "type": "object",
      "properties": {
        "id": { "type": "integer", "minimum": 1 },
        "user_id": { "type": "string" },
        "action": { 
          "type": "string", 
          "enum": ["create", "update", "delete", "export", "import", "validate"]
        },
        "table_name": { "type": "string" },
        "record_id": { "type": "integer" },
        "old_values": { "type": "object" },
        "new_values": { "type": "object" },
        "timestamp": { "type": "string", "format": "date-time" }
      },
      "required": ["id", "action", "timestamp"],
      "additionalProperties": false
    }
  },
  
  "type": "object",
  "properties": {
    "version": { "type": "string", "pattern": "^\\d+\\.\\d+\\.\\d+$" },
    "last_updated": { "type": "string", "format": "date-time" },
    "lookups": {
      "type": "array",
      "items": { "$ref": "#/definitions/lookupItem" }
    },
    "projects": {
      "type": "array",
      "items": { "$ref": "#/definitions/project" }
    },
    "config": {
      "type": "array",
      "items": { "$ref": "#/definitions/systemConfig" }
    },
    "audit_log": {
      "type": "array",
      "items": { "$ref": "#/definitions/auditLog" }
    }
  },
  "required": ["version", "last_updated", "lookups", "projects"],
  "additionalProperties": false
} 