{
  "version": "1.0.0",
  "last_updated": "2025-01-27T10:00:00Z",
  
  "lookups": [
    { "id": 1, "type": "genre", "value": "Web Development", "description": "Web applications and websites", "category": "code", "usage_count": 8, "created_at": "2025-01-01T00:00:00Z" },
    { "id": 2, "type": "genre", "value": "AI/ML", "description": "Artificial Intelligence and Machine Learning", "category": "code", "usage_count": 3, "created_at": "2025-01-01T00:00:00Z" },
    { "id": 3, "type": "genre", "value": "Mobile App", "description": "Mobile applications", "category": "code", "usage_count": 2, "created_at": "2025-01-01T00:00:00Z" },
    { "id": 4, "type": "genre", "value": "Creative Writing", "description": "Fiction and creative writing", "category": "writing", "usage_count": 2, "created_at": "2025-01-01T00:00:00Z" },
    { "id": 5, "type": "genre", "value": "Digital Art", "description": "Digital artwork and illustrations", "category": "art", "usage_count": 3, "created_at": "2025-01-01T00:00:00Z" },
    { "id": 6, "type": "genre", "value": "Game Development", "description": "Video game development", "category": "code", "usage_count": 1, "created_at": "2025-01-01T00:00:00Z" },
    { "id": 7, "type": "genre", "value": "Data Visualization", "description": "Data analysis and visualization", "category": "code", "usage_count": 1, "created_at": "2025-01-01T00:00:00Z" },
    { "id": 8, "type": "genre", "value": "Brand Identity", "description": "Brand design and identity work", "category": "art", "usage_count": 1, "created_at": "2025-01-01T00:00:00Z" },
    { "id": 101, "type": "style", "value": "Modern", "description": "Contemporary design approach", "category": "universal", "usage_count": 6, "created_at": "2025-01-01T00:00:00Z" },
    { "id": 102, "type": "style", "value": "Minimalist", "description": "Clean and simple design", "category": "universal", "usage_count": 4, "created_at": "2025-01-01T00:00:00Z" },
    { "id": 103, "type": "style", "value": "Experimental", "description": "Innovative and experimental approach", "category": "universal", "usage_count": 2, "created_at": "2025-01-01T00:00:00Z" },
    { "id": 104, "type": "style", "value": "Vintage", "description": "Retro and vintage aesthetic", "category": "art", "usage_count": 1, "created_at": "2025-01-01T00:00:00Z" },
    { "id": 105, "type": "style", "value": "Futuristic", "description": "Sci-fi and future-oriented design", "category": "universal", "usage_count": 2, "created_at": "2025-01-01T00:00:00Z" },
    { "id": 106, "type": "style", "value": "Organic", "description": "Natural and flowing design", "category": "art", "usage_count": 1, "created_at": "2025-01-01T00:00:00Z" },
    { "id": 201, "type": "technology", "value": "React", "description": "JavaScript library for building user interfaces", "category": "code", "usage_count": 5, "metadata": { "website": "https://reactjs.org", "icon": "‚öõÔ∏è" }, "created_at": "2025-01-01T00:00:00Z" },
    { "id": 202, "type": "technology", "value": "Python", "description": "Programming language", "category": "code", "usage_count": 4, "metadata": { "website": "https://python.org", "icon": "üêç" }, "created_at": "2025-01-01T00:00:00Z" },
    { "id": 203, "type": "technology", "value": "JavaScript", "description": "Programming language", "category": "code", "usage_count": 8, "metadata": { "website": "https://javascript.info", "icon": "üìú" }, "created_at": "2025-01-01T00:00:00Z" },
    { "id": 204, "type": "technology", "value": "Node.js", "description": "JavaScript runtime", "category": "code", "usage_count": 3, "metadata": { "website": "https://nodejs.org", "icon": "üü¢" }, "created_at": "2025-01-01T00:00:00Z" },
    { "id": 205, "type": "technology", "value": "CSS3", "description": "Styling language", "category": "code", "usage_count": 6, "metadata": { "website": "https://developer.mozilla.org/en-US/docs/Web/CSS", "icon": "üé®" }, "created_at": "2025-01-01T00:00:00Z" },
    { "id": 206, "type": "technology", "value": "HTML5", "description": "Markup language", "category": "code", "usage_count": 6, "metadata": { "website": "https://developer.mozilla.org/en-US/docs/Web/HTML", "icon": "üåê" }, "created_at": "2025-01-01T00:00:00Z" },
    { "id": 207, "type": "technology", "value": "TensorFlow", "description": "Machine learning framework", "category": "code", "usage_count": 1, "metadata": { "website": "https://tensorflow.org", "icon": "üß†" }, "created_at": "2025-01-01T00:00:00Z" },
    { "id": 208, "type": "technology", "value": "Photoshop", "description": "Image editing software", "category": "art", "usage_count": 2, "metadata": { "website": "https://adobe.com/photoshop", "icon": "üñºÔ∏è" }, "created_at": "2025-01-01T00:00:00Z" },
    { "id": 209, "type": "technology", "value": "Illustrator", "description": "Vector graphics software", "category": "art", "usage_count": 1, "metadata": { "website": "https://adobe.com/illustrator", "icon": "‚úèÔ∏è" }, "created_at": "2025-01-01T00:00:00Z" },
    { "id": 210, "type": "technology", "value": "Unity", "description": "Game development engine", "category": "code", "usage_count": 1, "metadata": { "website": "https://unity.com", "icon": "üéÆ" }, "created_at": "2025-01-01T00:00:00Z" },

    { "id": 301, "type": "mood", "value": "Energetic", "description": "High energy and dynamic", "category": "universal", "usage_count": 3, "created_at": "2025-01-01T00:00:00Z" },
    { "id": 302, "type": "mood", "value": "Serene", "description": "Calm and peaceful", "category": "universal", "usage_count": 2, "created_at": "2025-01-01T00:00:00Z" },
    { "id": 303, "type": "mood", "value": "Dark", "description": "Mysterious and intense", "category": "universal", "usage_count": 2, "created_at": "2025-01-01T00:00:00Z" },
    { "id": 304, "type": "mood", "value": "Mystical", "description": "Magical and enchanting", "category": "universal", "usage_count": 3, "created_at": "2025-01-01T00:00:00Z" },
    { "id": 305, "type": "mood", "value": "Innovative", "description": "Cutting-edge and forward-thinking", "category": "universal", "usage_count": 4, "created_at": "2025-01-01T00:00:00Z" },
    { "id": 306, "type": "mood", "value": "Playful", "description": "Fun and lighthearted", "category": "universal", "usage_count": 2, "created_at": "2025-01-01T00:00:00Z" },
    { "id": 307, "type": "mood", "value": "Professional", "description": "Business and corporate", "category": "universal", "usage_count": 3, "created_at": "2025-01-01T00:00:00Z" },
    { "id": 308, "type": "mood", "value": "Experimental", "description": "Avant-garde and boundary-pushing", "category": "universal", "usage_count": 1, "created_at": "2025-01-01T00:00:00Z" },

    { "id": 401, "type": "role", "value": "Lead Developer", "description": "Primary developer and project lead", "category": "code", "usage_count": 4, "created_at": "2025-01-01T00:00:00Z" },
    { "id": 402, "type": "role", "value": "Full Stack Developer", "description": "Frontend and backend development", "category": "code", "usage_count": 3, "created_at": "2025-01-01T00:00:00Z" },
    { "id": 403, "type": "role", "value": "UI/UX Designer", "description": "User interface and experience design", "category": "art", "usage_count": 2, "created_at": "2025-01-01T00:00:00Z" },
    { "id": 404, "type": "role", "value": "Creative Director", "description": "Creative vision and direction", "category": "art", "usage_count": 1, "created_at": "2025-01-01T00:00:00Z" },
    { "id": 405, "type": "role", "value": "Author", "description": "Primary writer and content creator", "category": "writing", "usage_count": 2, "created_at": "2025-01-01T00:00:00Z" },
    { "id": 406, "type": "role", "value": "Solo Developer", "description": "Independent developer", "category": "code", "usage_count": 2, "created_at": "2025-01-01T00:00:00Z" },

    { "id": 501, "type": "status", "value": "completed", "description": "Project is finished", "category": "universal", "usage_count": 12, "created_at": "2025-01-01T00:00:00Z" },
    { "id": 502, "type": "status", "value": "in-progress", "description": "Currently being developed", "category": "universal", "usage_count": 2, "created_at": "2025-01-01T00:00:00Z" },
    { "id": 503, "type": "status", "value": "development", "description": "In active development", "category": "universal", "usage_count": 1, "created_at": "2025-01-01T00:00:00Z" },
    { "id": 504, "type": "status", "value": "concept", "description": "Conceptual stage", "category": "universal", "usage_count": 0, "created_at": "2025-01-01T00:00:00Z" },
    { "id": 505, "type": "status", "value": "on-hold", "description": "Temporarily paused", "category": "universal", "usage_count": 0, "created_at": "2025-01-01T00:00:00Z" },

    { "id": 601, "type": "variant", "value": "featured", "description": "Featured project display", "category": "universal", "usage_count": 3, "created_at": "2025-01-01T00:00:00Z" },
    { "id": 602, "type": "variant", "value": "wide", "description": "Wide display format", "category": "universal", "usage_count": 2, "created_at": "2025-01-01T00:00:00Z" },
    { "id": 603, "type": "variant", "value": "standard", "description": "Standard display format", "category": "universal", "usage_count": 10, "created_at": "2025-01-01T00:00:00Z" },

    { "id": 701, "type": "link_type", "value": "github", "description": "GitHub repository", "category": "code", "usage_count": 8, "metadata": { "icon": "üêô" }, "created_at": "2025-01-01T00:00:00Z" },
    { "id": 702, "type": "link_type", "value": "demo", "description": "Live demo", "category": "code", "usage_count": 5, "metadata": { "icon": "üöÄ" }, "created_at": "2025-01-01T00:00:00Z" },
    { "id": 703, "type": "link_type", "value": "documentation", "description": "Project documentation", "category": "universal", "usage_count": 3, "metadata": { "icon": "üìö" }, "created_at": "2025-01-01T00:00:00Z" },